{
  "schema_version": "1.0.0",
  "command": "ansible-config",
  "description": "View ansible configuration.",
  "global_flags": [
    {
      "short": "-h",
      "long": "--help",
      "value_type": "Bool",
      "takes_value": false,
      "description": "show this help message and exit",
      "multiple": false,
      "conflicts_with": [],
      "requires": []
    },
    {
      "short": "-v",
      "long": "--verbose",
      "value_type": "Bool",
      "takes_value": false,
      "description": "Causes Ansible to print more debug messages. Adding multiple -v will increase the verbosity, the builtin plugins currently evaluate up to -vvvvvv. A reasonable level to start is -vvv, connection debugging might require -vvvv. This argument may be specified multiple times.",
      "multiple": true,
      "conflicts_with": [],
      "requires": [
        "-vvv"
      ]
    },
    {
      "short": null,
      "long": "--version",
      "value_type": "Bool",
      "takes_value": false,
      "description": "show program's version number, config file location, configured module search path, module location, executable location and exit",
      "multiple": false,
      "conflicts_with": [],
      "requires": []
    }
  ],
  "subcommands": [],
  "positional": [
    {
      "name": "dump",
      "value_type": "String",
      "required": true,
      "multiple": false,
      "description": "Dump configuration"
    },
    {
      "name": "init",
      "value_type": "String",
      "required": true,
      "multiple": false,
      "description": "Create initial configuration"
    },
    {
      "name": "list",
      "value_type": "String",
      "required": true,
      "multiple": false,
      "description": "Print all config options"
    },
    {
      "name": "validate",
      "value_type": "File",
      "required": true,
      "multiple": false,
      "description": "Validate the configuration file and environment variables. By default it only checks the base settings without accounting for plugins (see -t)."
    },
    {
      "name": "view",
      "value_type": "File",
      "required": true,
      "multiple": false,
      "description": "View configuration file"
    }
  ],
  "source": "HelpCommand",
  "confidence": 0.75,
  "version": null
}