{
  "schema_version": "1.0.0",
  "command": "apt",
  "description": "APT(8) APT APT(8)",
  "global_flags": [
    {
      "short": null,
      "long": "--help",
      "value_type": "Bool",
      "takes_value": false,
      "description": null,
      "multiple": false,
      "conflicts_with": [],
      "requires": []
    },
    {
      "short": null,
      "long": "--version",
      "value_type": "Bool",
      "takes_value": false,
      "description": null,
      "multiple": false,
      "conflicts_with": [],
      "requires": []
    },
    {
      "short": "-a",
      "long": null,
      "value_type": "String",
      "takes_value": true,
      "description": null,
      "multiple": false,
      "conflicts_with": [],
      "requires": []
    },
    {
      "short": "-c",
      "long": null,
      "value_type": "String",
      "takes_value": true,
      "description": null,
      "multiple": false,
      "conflicts_with": [],
      "requires": []
    },
    {
      "short": "-h",
      "long": null,
      "value_type": "Bool",
      "takes_value": false,
      "description": null,
      "multiple": false,
      "conflicts_with": [],
      "requires": []
    },
    {
      "short": "-o",
      "long": null,
      "value_type": "String",
      "takes_value": true,
      "description": null,
      "multiple": false,
      "conflicts_with": [],
      "requires": []
    },
    {
      "short": "-t",
      "long": null,
      "value_type": "String",
      "takes_value": true,
      "description": null,
      "multiple": false,
      "conflicts_with": [],
      "requires": []
    },
    {
      "short": "-v",
      "long": null,
      "value_type": "Bool",
      "takes_value": false,
      "description": null,
      "multiple": false,
      "conflicts_with": [],
      "requires": []
    }
  ],
  "subcommands": [],
  "positional": [
    {
      "name": "-h",
      "value_type": "String",
      "required": false,
      "multiple": false,
      "description": null
    },
    {
      "name": "-v",
      "value_type": "String",
      "required": true,
      "multiple": false,
      "description": null
    },
    {
      "name": "edit-sources",
      "value_type": "String",
      "required": true,
      "multiple": false,
      "description": null
    },
    {
      "name": "full-upgrade",
      "value_type": "String",
      "required": true,
      "multiple": false,
      "description": null
    },
    {
      "name": "list",
      "value_type": "String",
      "required": true,
      "multiple": false,
      "description": null
    },
    {
      "name": "pkg",
      "value_type": "String",
      "required": true,
      "multiple": false,
      "description": null
    },
    {
      "name": "remove",
      "value_type": "String",
      "required": true,
      "multiple": false,
      "description": null
    },
    {
      "name": "search",
      "value_type": "String",
      "required": true,
      "multiple": false,
      "description": null
    },
    {
      "name": "show",
      "value_type": "String",
      "required": true,
      "multiple": false,
      "description": null
    },
    {
      "name": "update",
      "value_type": "String",
      "required": true,
      "multiple": false,
      "description": null
    },
    {
      "name": "upgrade",
      "value_type": "String",
      "required": true,
      "multiple": false,
      "description": null
    }
  ],
  "source": "ManPage",
  "confidence": 0.9,
  "version": null
}