{
  "schema_version": "1.0.0",
  "command": "resizecons",
  "description": "resizecons - change kernel idea of the console size",
  "global_flags": [],
  "subcommands": [],
  "positional": [
    {
      "name": "ROWS",
      "value_type": "String",
      "required": true,
      "multiple": false,
      "description": null
    }
  ],
  "source": "ManPage",
  "confidence": 0.75,
  "version": null
}