{
  "schema_version": "1.0.0",
  "command": "rdma",
  "description": "RDMA(8) Linux RDMA(8)",
  "global_flags": [
    {
      "short": "-d",
      "long": "--details",
      "value_type": "Bool",
      "takes_value": false,
      "description": "Adding a second -d includes driver-specific details.",
      "multiple": false,
      "conflicts_with": [],
      "requires": []
    },
    {
      "short": "-j",
      "long": "--json",
      "value_type": "String",
      "takes_value": true,
      "description": null,
      "multiple": false,
      "conflicts_with": [],
      "requires": []
    },
    {
      "short": "-p",
      "long": "--pretty",
      "value_type": "String",
      "takes_value": true,
      "description": null,
      "multiple": false,
      "conflicts_with": [],
      "requires": []
    },
    {
      "short": "-r",
      "long": "--raw",
      "value_type": "Bool",
      "takes_value": false,
      "description": null,
      "multiple": false,
      "conflicts_with": [],
      "requires": []
    },
    {
      "short": "-V",
      "long": null,
      "value_type": "Bool",
      "takes_value": false,
      "description": null,
      "multiple": false,
      "conflicts_with": [],
      "requires": []
    },
    {
      "short": "-V[ersion",
      "long": null,
      "value_type": "Bool",
      "takes_value": false,
      "description": null,
      "multiple": false,
      "conflicts_with": [],
      "requires": []
    },
    {
      "short": "-b",
      "long": null,
      "value_type": "Bool",
      "takes_value": false,
      "description": "First failure will cause termination of rdma.",
      "multiple": false,
      "conflicts_with": [],
      "requires": []
    },
    {
      "short": "-batch",
      "long": null,
      "value_type": "File",
      "takes_value": true,
      "description": null,
      "multiple": false,
      "conflicts_with": [],
      "requires": []
    },
    {
      "short": "-d[etails",
      "long": null,
      "value_type": "Bool",
      "takes_value": false,
      "description": null,
      "multiple": false,
      "conflicts_with": [],
      "requires": []
    },
    {
      "short": "-force",
      "long": null,
      "value_type": "Bool",
      "takes_value": false,
      "description": "If there were any errors during execution of the commands, the application return code will be non zero.",
      "multiple": false,
      "conflicts_with": [],
      "requires": []
    },
    {
      "short": "-j[son",
      "long": null,
      "value_type": "Bool",
      "takes_value": false,
      "description": null,
      "multiple": false,
      "conflicts_with": [],
      "requires": []
    },
    {
      "short": "-p[retty",
      "long": null,
      "value_type": "Bool",
      "takes_value": false,
      "description": null,
      "multiple": false,
      "conflicts_with": [],
      "requires": []
    }
  ],
  "subcommands": [],
  "positional": [
    {
      "name": "dev",
      "value_type": "String",
      "required": true,
      "multiple": false,
      "description": null
    },
    {
      "name": "filename",
      "value_type": "File",
      "required": true,
      "multiple": false,
      "description": null
    },
    {
      "name": "help",
      "value_type": "String",
      "required": true,
      "multiple": false,
      "description": null
    },
    {
      "name": "link",
      "value_type": "String",
      "required": true,
      "multiple": false,
      "description": null
    },
    {
      "name": "object",
      "value_type": "String",
      "required": true,
      "multiple": false,
      "description": null
    },
    {
      "name": "resource",
      "value_type": "String",
      "required": true,
      "multiple": false,
      "description": null
    },
    {
      "name": "statistic",
      "value_type": "String",
      "required": true,
      "multiple": false,
      "description": null
    },
    {
      "name": "system",
      "value_type": "String",
      "required": true,
      "multiple": false,
      "description": null
    }
  ],
  "source": "ManPage",
  "confidence": 0.9,
  "version": null
}