{
  "schema_version": "1.0.0",
  "command": "ssh-copy-id",
  "description": null,
  "global_flags": [
    {
      "short": "-h",
      "long": null,
      "value_type": "Bool",
      "takes_value": false,
      "description": null,
      "multiple": false,
      "conflicts_with": [],
      "requires": []
    }
  ],
  "subcommands": [],
  "positional": [
    {
      "name": "identity_file",
      "value_type": "File",
      "required": false,
      "multiple": false,
      "description": null
    },
    {
      "name": "ssh",
      "value_type": "String",
      "required": true,
      "multiple": false,
      "description": null
    }
  ],
  "source": "HelpCommand",
  "confidence": 0.7,
  "version": null
}