{
  "schema_version": "1.0.0",
  "command": "ebtables-nft-save",
  "description": "xtables-nft — iptables using nftables kernel api",
  "global_flags": [
    {
      "short": "-V",
      "long": null,
      "value_type": "Bool",
      "takes_value": false,
      "description": null,
      "multiple": false,
      "conflicts_with": [],
      "requires": []
    }
  ],
  "subcommands": [
    {
      "name": "bles-nft",
      "description": "will NOT need to retrieve the current ruleset from the kernel, change it, and re-load the altered ruleset. Instead, ipta‐",
      "flags": [],
      "positional": [],
      "subcommands": [],
      "aliases": []
    },
    {
      "name": "iptables",
      "description": null,
      "flags": [],
      "positional": [],
      "subcommands": [],
      "aliases": []
    }
  ],
  "positional": [],
  "source": "ManPage",
  "confidence": 0.85,
  "version": null
}