{
  "schema_version": "1.0.0",
  "command": "systemd-id128",
  "description": "Generate and print 128-bit identifiers.",
  "global_flags": [
    {
      "short": null,
      "long": "--app-specific",
      "value_type": "String",
      "takes_value": true,
      "description": "Generate app-specific IDs",
      "multiple": false,
      "conflicts_with": [],
      "requires": []
    },
    {
      "short": null,
      "long": "--help",
      "value_type": "Bool",
      "takes_value": false,
      "description": "Show this help",
      "multiple": false,
      "conflicts_with": [],
      "requires": []
    },
    {
      "short": null,
      "long": "--pretty",
      "value_type": "Bool",
      "takes_value": false,
      "description": "Generate samples of program code",
      "multiple": false,
      "conflicts_with": [],
      "requires": []
    },
    {
      "short": null,
      "long": "--uuid",
      "value_type": "String",
      "takes_value": true,
      "description": "Output in UUID format",
      "multiple": false,
      "conflicts_with": [],
      "requires": []
    },
    {
      "short": null,
      "long": "--value",
      "value_type": "String",
      "takes_value": true,
      "description": "Only print the value",
      "multiple": false,
      "conflicts_with": [],
      "requires": []
    },
    {
      "short": "-P",
      "long": null,
      "value_type": "String",
      "takes_value": true,
      "description": "Only print the value",
      "multiple": false,
      "conflicts_with": [],
      "requires": []
    },
    {
      "short": "-a",
      "long": null,
      "value_type": "String",
      "takes_value": true,
      "description": "Generate app-specific IDs",
      "multiple": false,
      "conflicts_with": [],
      "requires": []
    },
    {
      "short": "-h",
      "long": null,
      "value_type": "Bool",
      "takes_value": false,
      "description": "Show this help",
      "multiple": false,
      "conflicts_with": [],
      "requires": []
    },
    {
      "short": "-p",
      "long": null,
      "value_type": "Bool",
      "takes_value": false,
      "description": "Generate samples of program code",
      "multiple": false,
      "conflicts_with": [],
      "requires": []
    },
    {
      "short": "-u",
      "long": null,
      "value_type": "String",
      "takes_value": true,
      "description": "Output in UUID format",
      "multiple": false,
      "conflicts_with": [],
      "requires": []
    }
  ],
  "subcommands": [
    {
      "name": "new",
      "description": "Generate a new ID machine-id              Print the ID of current machine boot-id                 Print the ID of current boot invocation-id           Print the ID of current invocation show [NAME|UUID]        Print one or more UUIDs help                    Show this help",
      "flags": [
        {
          "short": null,
          "long": "--app-specific",
          "value_type": "String",
          "takes_value": true,
          "description": "Generate app-specific IDs",
          "multiple": false,
          "conflicts_with": [],
          "requires": []
        },
        {
          "short": null,
          "long": "--help",
          "value_type": "Bool",
          "takes_value": false,
          "description": "Show this help",
          "multiple": false,
          "conflicts_with": [],
          "requires": []
        },
        {
          "short": null,
          "long": "--pretty",
          "value_type": "Bool",
          "takes_value": false,
          "description": "Generate samples of program code",
          "multiple": false,
          "conflicts_with": [],
          "requires": []
        },
        {
          "short": null,
          "long": "--uuid",
          "value_type": "String",
          "takes_value": true,
          "description": "Output in UUID format",
          "multiple": false,
          "conflicts_with": [],
          "requires": []
        },
        {
          "short": null,
          "long": "--value",
          "value_type": "String",
          "takes_value": true,
          "description": "Only print the value",
          "multiple": false,
          "conflicts_with": [],
          "requires": []
        },
        {
          "short": "-P",
          "long": null,
          "value_type": "String",
          "takes_value": true,
          "description": "Only print the value",
          "multiple": false,
          "conflicts_with": [],
          "requires": []
        },
        {
          "short": "-a",
          "long": null,
          "value_type": "String",
          "takes_value": true,
          "description": "Generate app-specific IDs",
          "multiple": false,
          "conflicts_with": [],
          "requires": []
        },
        {
          "short": "-h",
          "long": null,
          "value_type": "Bool",
          "takes_value": false,
          "description": "Show this help",
          "multiple": false,
          "conflicts_with": [],
          "requires": []
        },
        {
          "short": "-p",
          "long": null,
          "value_type": "Bool",
          "takes_value": false,
          "description": "Generate samples of program code",
          "multiple": false,
          "conflicts_with": [],
          "requires": []
        },
        {
          "short": "-u",
          "long": null,
          "value_type": "String",
          "takes_value": true,
          "description": "Output in UUID format",
          "multiple": false,
          "conflicts_with": [],
          "requires": []
        }
      ],
      "positional": [],
      "subcommands": [],
      "aliases": []
    }
  ],
  "positional": [],
  "source": "HelpCommand",
  "confidence": 1.0,
  "version": null
}