{
  "schema_version": "1.0.0",
  "command": "ucfr",
  "description": "Debian GNU/Linux ucfr Revision 3.00.",
  "global_flags": [
    {
      "short": "-f",
      "long": "--force",
      "value_type": "Bool",
      "takes_value": false,
      "description": null,
      "multiple": false,
      "conflicts_with": [],
      "requires": []
    },
    {
      "short": "-h",
      "long": "--help",
      "value_type": "Bool",
      "takes_value": false,
      "description": null,
      "multiple": false,
      "conflicts_with": [],
      "requires": []
    },
    {
      "short": "-n",
      "long": "--no-action",
      "value_type": "Bool",
      "takes_value": false,
      "description": null,
      "multiple": false,
      "conflicts_with": [],
      "requires": []
    },
    {
      "short": "-p",
      "long": "--purge",
      "value_type": "Bool",
      "takes_value": false,
      "description": null,
      "multiple": false,
      "conflicts_with": [],
      "requires": []
    },
    {
      "short": null,
      "long": "--state-dir",
      "value_type": "Bool",
      "takes_value": false,
      "description": null,
      "multiple": false,
      "conflicts_with": [],
      "requires": []
    },
    {
      "short": "-v",
      "long": "--verbose",
      "value_type": "Bool",
      "takes_value": false,
      "description": null,
      "multiple": false,
      "conflicts_with": [],
      "requires": []
    },
    {
      "short": "-d",
      "long": null,
      "value_type": "String",
      "takes_value": true,
      "description": "[n] Set the Debug level to N",
      "multiple": false,
      "conflicts_with": [],
      "requires": []
    }
  ],
  "subcommands": [],
  "positional": [],
  "source": "HelpCommand",
  "confidence": 0.8,
  "version": null
}