{
  "schema_version": "1.0.0",
  "command": "cargo-fmt",
  "description": "This utility formats all bin and lib files of the current crate using rustfmt.",
  "global_flags": [
    {
      "short": null,
      "long": "--all",
      "value_type": "Bool",
      "takes_value": false,
      "description": null,
      "multiple": false,
      "conflicts_with": [],
      "requires": []
    },
    {
      "short": null,
      "long": "--check",
      "value_type": "Bool",
      "takes_value": false,
      "description": null,
      "multiple": false,
      "conflicts_with": [],
      "requires": []
    },
    {
      "short": "-h",
      "long": "--help",
      "value_type": "Bool",
      "takes_value": false,
      "description": null,
      "multiple": false,
      "conflicts_with": [],
      "requires": []
    },
    {
      "short": null,
      "long": "--manifest-path",
      "value_type": "String",
      "takes_value": true,
      "description": null,
      "multiple": false,
      "conflicts_with": [],
      "requires": []
    },
    {
      "short": null,
      "long": "--message-format",
      "value_type": "String",
      "takes_value": true,
      "description": null,
      "multiple": false,
      "conflicts_with": [],
      "requires": []
    },
    {
      "short": "-p",
      "long": "--package",
      "value_type": "String",
      "takes_value": true,
      "description": null,
      "multiple": true,
      "conflicts_with": [],
      "requires": []
    },
    {
      "short": "-q",
      "long": "--quiet",
      "value_type": "Bool",
      "takes_value": false,
      "description": null,
      "multiple": false,
      "conflicts_with": [],
      "requires": []
    },
    {
      "short": "-v",
      "long": "--verbose",
      "value_type": "Bool",
      "takes_value": false,
      "description": null,
      "multiple": false,
      "conflicts_with": [],
      "requires": []
    },
    {
      "short": null,
      "long": "--version",
      "value_type": "Bool",
      "takes_value": false,
      "description": null,
      "multiple": false,
      "conflicts_with": [],
      "requires": []
    }
  ],
  "subcommands": [],
  "positional": [],
  "source": "HelpCommand",
  "confidence": 0.8,
  "version": null
}