{
  "schema_version": "1.0.0",
  "command": "head",
  "description": "HEAD(1) User Commands HEAD(1)",
  "global_flags": [
    {
      "short": "-c",
      "long": "--bytes",
      "value_type": "String",
      "takes_value": true,
      "description": null,
      "multiple": false,
      "conflicts_with": [],
      "requires": []
    },
    {
      "short": null,
      "long": "--help",
      "value_type": "Bool",
      "takes_value": false,
      "description": null,
      "multiple": false,
      "conflicts_with": [],
      "requires": []
    },
    {
      "short": "-n",
      "long": "--lines",
      "value_type": "String",
      "takes_value": true,
      "description": null,
      "multiple": false,
      "conflicts_with": [],
      "requires": []
    },
    {
      "short": "-q",
      "long": "--quiet",
      "value_type": "Bool",
      "takes_value": false,
      "description": null,
      "multiple": false,
      "conflicts_with": [],
      "requires": []
    },
    {
      "short": "-v",
      "long": "--verbose",
      "value_type": "Bool",
      "takes_value": false,
      "description": null,
      "multiple": false,
      "conflicts_with": [],
      "requires": []
    },
    {
      "short": null,
      "long": "--version",
      "value_type": "Bool",
      "takes_value": false,
      "description": null,
      "multiple": false,
      "conflicts_with": [],
      "requires": []
    },
    {
      "short": "-z",
      "long": "--zero-terminated",
      "value_type": "Bool",
      "takes_value": false,
      "description": null,
      "multiple": false,
      "conflicts_with": [],
      "requires": []
    }
  ],
  "subcommands": [],
  "positional": [],
  "source": "ManPage",
  "confidence": 0.8,
  "version": null
}