{
  "schema_version": "1.0.0",
  "command": "kernel-install",
  "description": "Add and remove kernel and initrd images to and from /boot/",
  "global_flags": [
    {
      "short": null,
      "long": "--boot-path",
      "value_type": "File",
      "takes_value": true,
      "description": "Path to the $BOOT partition",
      "multiple": false,
      "conflicts_with": [],
      "requires": []
    },
    {
      "short": null,
      "long": "--entry-token",
      "value_type": "String",
      "takes_value": true,
      "description": null,
      "multiple": false,
      "conflicts_with": [],
      "requires": []
    },
    {
      "short": null,
      "long": "--esp-path",
      "value_type": "File",
      "takes_value": true,
      "description": "Path to the EFI System Partition (ESP)",
      "multiple": false,
      "conflicts_with": [],
      "requires": []
    },
    {
      "short": "-h",
      "long": "--help",
      "value_type": "Bool",
      "takes_value": false,
      "description": "Show this help",
      "multiple": false,
      "conflicts_with": [],
      "requires": []
    },
    {
      "short": null,
      "long": "--image",
      "value_type": "File",
      "takes_value": true,
      "description": "Operate on disk image as filesystem root",
      "multiple": false,
      "conflicts_with": [],
      "requires": []
    },
    {
      "short": null,
      "long": "--image-policy",
      "value_type": "String",
      "takes_value": true,
      "description": "Specify disk image dissection policy",
      "multiple": false,
      "conflicts_with": [],
      "requires": []
    },
    {
      "short": null,
      "long": "--json",
      "value_type": "String",
      "takes_value": true,
      "description": "Generate JSON output",
      "multiple": false,
      "conflicts_with": [],
      "requires": []
    },
    {
      "short": null,
      "long": "--make-entry-directory",
      "value_type": "Directory",
      "takes_value": true,
      "description": null,
      "multiple": false,
      "conflicts_with": [],
      "requires": []
    },
    {
      "short": null,
      "long": "--no-legend",
      "value_type": "Bool",
      "takes_value": false,
      "description": "Do not show the headers and footers",
      "multiple": false,
      "conflicts_with": [],
      "requires": []
    },
    {
      "short": null,
      "long": "--no-pager",
      "value_type": "Bool",
      "takes_value": false,
      "description": "Do not pipe inspect output into a pager",
      "multiple": false,
      "conflicts_with": [],
      "requires": []
    },
    {
      "short": null,
      "long": "--root",
      "value_type": "File",
      "takes_value": true,
      "description": "Operate on an alternate filesystem root",
      "multiple": false,
      "conflicts_with": [],
      "requires": []
    },
    {
      "short": "-v",
      "long": "--verbose",
      "value_type": "Bool",
      "takes_value": false,
      "description": "Increase verbosity",
      "multiple": false,
      "conflicts_with": [],
      "requires": []
    },
    {
      "short": null,
      "long": "--version",
      "value_type": "Bool",
      "takes_value": false,
      "description": "Show package version",
      "multiple": false,
      "conflicts_with": [],
      "requires": []
    }
  ],
  "subcommands": [],
  "positional": [
    {
      "name": "INITRD",
      "value_type": "String",
      "required": false,
      "multiple": false,
      "description": null
    },
    {
      "name": "KERNEL-VERSION",
      "value_type": "String",
      "required": false,
      "multiple": false,
      "description": null
    }
  ],
  "source": "HelpCommand",
  "confidence": 0.9,
  "version": null
}