{
  "schema_version": "1.0.0",
  "command": "ifconfig",
  "description": "IFCONFIG(8) Linux System Administrator's Manual IFCONFIG(8)",
  "global_flags": [
    {
      "short": "-a",
      "long": null,
      "value_type": "Bool",
      "takes_value": false,
      "description": "display all interfaces which are currently available, even if down",
      "multiple": false,
      "conflicts_with": [],
      "requires": []
    },
    {
      "short": "-s",
      "long": null,
      "value_type": "Bool",
      "takes_value": false,
      "description": "display a short list (like netstat -i)",
      "multiple": false,
      "conflicts_with": [],
      "requires": []
    },
    {
      "short": "-v",
      "long": null,
      "value_type": "Bool",
      "takes_value": false,
      "description": "be more verbose for some error conditions",
      "multiple": false,
      "conflicts_with": [],
      "requires": []
    }
  ],
  "subcommands": [
    {
      "name": "up",
      "description": "This flag causes the interface to be activated. It is implicitly specified if an address is assigned to the interface; you can sup‚Äê",
      "flags": [],
      "positional": [],
      "subcommands": [],
      "aliases": []
    }
  ],
  "positional": [
    {
      "name": "-a",
      "value_type": "String",
      "required": false,
      "multiple": false,
      "description": null
    },
    {
      "name": "-s",
      "value_type": "String",
      "required": false,
      "multiple": false,
      "description": null
    },
    {
      "name": "-v",
      "value_type": "String",
      "required": false,
      "multiple": false,
      "description": null
    },
    {
      "name": "address",
      "value_type": "String",
      "required": true,
      "multiple": false,
      "description": null
    },
    {
      "name": "aftype",
      "value_type": "String",
      "required": false,
      "multiple": false,
      "description": null
    },
    {
      "name": "interface",
      "value_type": "String",
      "required": false,
      "multiple": false,
      "description": null
    }
  ],
  "source": "ManPage",
  "confidence": 0.95,
  "version": null
}