{
  "schema_version": "1.0.0",
  "command": "on_ac_power",
  "description": "on_ac_power - test whether computer is running on AC power",
  "global_flags": [],
  "subcommands": [],
  "positional": [
    {
      "name": "EXIT",
      "value_type": "String",
      "required": true,
      "multiple": false,
      "description": null
    },
    {
      "name": "STATUS",
      "value_type": "String",
      "required": true,
      "multiple": false,
      "description": null
    }
  ],
  "source": "ManPage",
  "confidence": 0.75,
  "version": null
}