{
  "schema_version": "1.0.0",
  "command": "xxd",
  "description": null,
  "global_flags": [
    {
      "short": "-C",
      "long": null,
      "value_type": "Bool",
      "takes_value": false,
      "description": "capitalize variable names in C include file style (-i).",
      "multiple": false,
      "conflicts_with": [],
      "requires": []
    },
    {
      "short": "-E",
      "long": null,
      "value_type": "Bool",
      "takes_value": false,
      "description": "show characters in EBCDIC. Default ASCII.",
      "multiple": false,
      "conflicts_with": [],
      "requires": []
    },
    {
      "short": "-R",
      "long": null,
      "value_type": "String",
      "takes_value": true,
      "description": "colorize the output; <when> can be 'always', 'auto' or 'never'. Default: 'auto'.",
      "multiple": false,
      "conflicts_with": [],
      "requires": []
    },
    {
      "short": "-a",
      "long": null,
      "value_type": "Bool",
      "takes_value": false,
      "description": "toggle autoskip: A single '*' replaces nul-lines. Default off.",
      "multiple": false,
      "conflicts_with": [],
      "requires": []
    },
    {
      "short": "-b",
      "long": null,
      "value_type": "Bool",
      "takes_value": false,
      "description": "binary digit dump (incompatible with -ps,-i). Default hex.",
      "multiple": false,
      "conflicts_with": [
        "-ps",
        "-i"
      ],
      "requires": []
    },
    {
      "short": "-c",
      "long": null,
      "value_type": "String",
      "takes_value": true,
      "description": "format <cols> octets per line. Default 16 (-i: 12, -ps: 30).",
      "multiple": false,
      "conflicts_with": [],
      "requires": []
    },
    {
      "short": "-d",
      "long": null,
      "value_type": "Bool",
      "takes_value": false,
      "description": "show offset in decimal instead of hex.",
      "multiple": false,
      "conflicts_with": [],
      "requires": []
    },
    {
      "short": "-e",
      "long": null,
      "value_type": "Bool",
      "takes_value": false,
      "description": "little-endian dump (incompatible with -ps,-i,-r).",
      "multiple": false,
      "conflicts_with": [
        "-end",
        "-ps",
        "-i",
        "-r"
      ],
      "requires": []
    },
    {
      "short": "-g",
      "long": null,
      "value_type": "Bool",
      "takes_value": false,
      "description": "number of octets per group in normal output. Default 2 (-e: 4).",
      "multiple": false,
      "conflicts_with": [],
      "requires": []
    },
    {
      "short": "-h",
      "long": null,
      "value_type": "Bool",
      "takes_value": false,
      "description": "print this summary.",
      "multiple": false,
      "conflicts_with": [],
      "requires": []
    },
    {
      "short": "-i",
      "long": null,
      "value_type": "Bool",
      "takes_value": false,
      "description": "output in C include file style.",
      "multiple": false,
      "conflicts_with": [],
      "requires": []
    },
    {
      "short": "-l",
      "long": null,
      "value_type": "String",
      "takes_value": true,
      "description": "stop after <len> octets.",
      "multiple": false,
      "conflicts_with": [],
      "requires": []
    },
    {
      "short": "-n",
      "long": null,
      "value_type": "Bool",
      "takes_value": false,
      "description": "set the variable name used in C include output (-i).",
      "multiple": false,
      "conflicts_with": [],
      "requires": []
    },
    {
      "short": "-o",
      "long": null,
      "value_type": "File",
      "takes_value": true,
      "description": "add <off> to the displayed file position.",
      "multiple": false,
      "conflicts_with": [],
      "requires": []
    },
    {
      "short": "-ps",
      "long": null,
      "value_type": "Bool",
      "takes_value": false,
      "description": "output in postscript plain hexdump style.",
      "multiple": false,
      "conflicts_with": [],
      "requires": []
    },
    {
      "short": "-r",
      "long": null,
      "value_type": "File",
      "takes_value": true,
      "description": "revert with <off> added to file positions found in hexdump.",
      "multiple": false,
      "conflicts_with": [],
      "requires": []
    },
    {
      "short": "-s",
      "long": null,
      "value_type": "File",
      "takes_value": true,
      "description": "start at <seek> bytes abs. (or +: rel.) infile offset.",
      "multiple": false,
      "conflicts_with": [],
      "requires": []
    },
    {
      "short": "-u",
      "long": null,
      "value_type": "Bool",
      "takes_value": false,
      "description": "use upper case hex letters.",
      "multiple": false,
      "conflicts_with": [],
      "requires": []
    },
    {
      "short": "-v",
      "long": null,
      "value_type": "Bool",
      "takes_value": false,
      "description": "show version: \"xxd 2023-10-25 by Juergen Weigert et al.\".",
      "multiple": false,
      "conflicts_with": [],
      "requires": []
    }
  ],
  "subcommands": [],
  "positional": [
    {
      "name": "infile",
      "value_type": "File",
      "required": false,
      "multiple": false,
      "description": null
    },
    {
      "name": "outfile",
      "value_type": "File",
      "required": false,
      "multiple": false,
      "description": null
    }
  ],
  "source": "HelpCommand",
  "confidence": 0.85,
  "version": null
}