{
  "schema_version": "1.0.0",
  "command": "glib-compile-schemas",
  "description": "Compile all GSettings schema files into a schema cache.",
  "global_flags": [
    {
      "short": null,
      "long": "--allow-any-name",
      "value_type": "Bool",
      "takes_value": false,
      "description": "Do not enforce key name restrictions",
      "multiple": false,
      "conflicts_with": [],
      "requires": []
    },
    {
      "short": null,
      "long": "--dry-run",
      "value_type": "Bool",
      "takes_value": false,
      "description": "Do not write the gschema.compiled file",
      "multiple": false,
      "conflicts_with": [],
      "requires": []
    },
    {
      "short": "-h",
      "long": "--help",
      "value_type": "Bool",
      "takes_value": false,
      "description": "Show help options",
      "multiple": false,
      "conflicts_with": [],
      "requires": []
    },
    {
      "short": null,
      "long": "--strict",
      "value_type": "Bool",
      "takes_value": false,
      "description": "Abort on any errors in schemas",
      "multiple": false,
      "conflicts_with": [],
      "requires": []
    },
    {
      "short": null,
      "long": "--targetdir",
      "value_type": "File",
      "takes_value": true,
      "description": "Where to store the gschemas.compiled file",
      "multiple": false,
      "conflicts_with": [],
      "requires": []
    },
    {
      "short": null,
      "long": "--version",
      "value_type": "Bool",
      "takes_value": false,
      "description": "Show program version and exit",
      "multiple": false,
      "conflicts_with": [],
      "requires": []
    }
  ],
  "subcommands": [],
  "positional": [
    {
      "name": "DIRECTORY",
      "value_type": "Directory",
      "required": true,
      "multiple": false,
      "description": null
    }
  ],
  "source": "HelpCommand",
  "confidence": 0.9,
  "version": null
}