{
  "schema_version": "1.0.0",
  "command": "llvm-remarkutil-18",
  "description": "LLVM-REMARKUTIL(1) LLVM LLVM-REMARKUTIL(1)",
  "global_flags": [
    {
      "short": null,
      "long": "--parser",
      "value_type": "String",
      "takes_value": true,
      "description": "* yaml: The tool will parse YAML remarks.  * bitstream: The tool will  parse  bit‚Äê stream remarks.",
      "multiple": false,
      "conflicts_with": [],
      "requires": []
    },
    {
      "short": null,
      "long": "--pretty",
      "value_type": "String",
      "takes_value": true,
      "description": null,
      "multiple": false,
      "conflicts_with": [],
      "requires": []
    },
    {
      "short": null,
      "long": "--report-style",
      "value_type": "String",
      "takes_value": true,
      "description": "* human: Human-readable textual report. Default option.  * json: JSON report.",
      "multiple": false,
      "conflicts_with": [],
      "requires": []
    },
    {
      "short": "-o",
      "long": null,
      "value_type": "String",
      "takes_value": true,
      "description": null,
      "multiple": false,
      "conflicts_with": [],
      "requires": []
    }
  ],
  "subcommands": [
    {
      "name": "bitstream2yaml",
      "description": "OVERVIEW: Remark file utilities",
      "flags": [
        {
          "short": null,
          "long": "--help",
          "value_type": "Bool",
          "takes_value": false,
          "description": null,
          "multiple": false,
          "conflicts_with": [],
          "requires": []
        },
        {
          "short": null,
          "long": "--help-list",
          "value_type": "Bool",
          "takes_value": false,
          "description": null,
          "multiple": false,
          "conflicts_with": [],
          "requires": []
        },
        {
          "short": "-o",
          "long": null,
          "value_type": "File",
          "takes_value": true,
          "description": null,
          "multiple": false,
          "conflicts_with": [],
          "requires": []
        }
      ],
      "positional": [
        {
          "name": "bitstream2yaml",
          "value_type": "String",
          "required": true,
          "multiple": false,
          "description": null
        },
        {
          "name": "input",
          "value_type": "String",
          "required": true,
          "multiple": false,
          "description": null
        },
        {
          "name": "llvm-remarkutil-18",
          "value_type": "String",
          "required": true,
          "multiple": false,
          "description": null
        }
      ],
      "subcommands": [],
      "aliases": []
    },
    {
      "name": "instruction-count",
      "description": "OVERVIEW: Remark file utilities",
      "flags": [
        {
          "short": null,
          "long": "--help",
          "value_type": "Bool",
          "takes_value": false,
          "description": null,
          "multiple": false,
          "conflicts_with": [],
          "requires": []
        },
        {
          "short": null,
          "long": "--help-list",
          "value_type": "Bool",
          "takes_value": false,
          "description": null,
          "multiple": false,
          "conflicts_with": [],
          "requires": []
        },
        {
          "short": null,
          "long": "--parser",
          "value_type": "String",
          "takes_value": true,
          "description": null,
          "multiple": false,
          "conflicts_with": [],
          "requires": []
        },
        {
          "short": null,
          "long": "--use-debug-loc",
          "value_type": "Bool",
          "takes_value": false,
          "description": null,
          "multiple": false,
          "conflicts_with": [],
          "requires": []
        },
        {
          "short": "-o",
          "long": null,
          "value_type": "File",
          "takes_value": true,
          "description": null,
          "multiple": false,
          "conflicts_with": [],
          "requires": []
        }
      ],
      "positional": [
        {
          "name": "input",
          "value_type": "String",
          "required": true,
          "multiple": false,
          "description": null
        },
        {
          "name": "llvm-remarkutil-18",
          "value_type": "String",
          "required": true,
          "multiple": false,
          "description": null
        }
      ],
      "subcommands": [],
      "aliases": []
    },
    {
      "name": "yaml2bitstream",
      "description": "OVERVIEW: Remark file utilities",
      "flags": [
        {
          "short": null,
          "long": "--help",
          "value_type": "Bool",
          "takes_value": false,
          "description": null,
          "multiple": false,
          "conflicts_with": [],
          "requires": []
        },
        {
          "short": null,
          "long": "--help-list",
          "value_type": "Bool",
          "takes_value": false,
          "description": null,
          "multiple": false,
          "conflicts_with": [],
          "requires": []
        },
        {
          "short": "-o",
          "long": null,
          "value_type": "File",
          "takes_value": true,
          "description": null,
          "multiple": false,
          "conflicts_with": [],
          "requires": []
        }
      ],
      "positional": [
        {
          "name": "input",
          "value_type": "String",
          "required": true,
          "multiple": false,
          "description": null
        },
        {
          "name": "llvm-remarkutil-18",
          "value_type": "String",
          "required": true,
          "multiple": false,
          "description": null
        },
        {
          "name": "yaml2bitstream",
          "value_type": "String",
          "required": true,
          "multiple": false,
          "description": null
        }
      ],
      "subcommands": [],
      "aliases": []
    }
  ],
  "positional": [
    {
      "name": "subcommmand",
      "value_type": "String",
      "required": false,
      "multiple": false,
      "description": null
    }
  ],
  "source": "ManPage",
  "confidence": 1.0,
  "version": null
}