{
  "schema_version": "1.0.0",
  "command": "bzexe",
  "description": "BZEXE(1) General Commands Manual BZEXE(1)",
  "global_flags": [
    {
      "short": "-d",
      "long": null,
      "value_type": "Bool",
      "takes_value": false,
      "description": "Decompress the given executables instead of compressing them.",
      "multiple": false,
      "conflicts_with": [],
      "requires": []
    },
    {
      "short": "-r-xr-xr-x",
      "long": null,
      "value_type": "Bool",
      "takes_value": false,
      "description": "1 root  bin   9644 Feb 11 11:16 /bin/cat",
      "multiple": false,
      "conflicts_with": [],
      "requires": []
    }
  ],
  "subcommands": [],
  "positional": [
    {
      "name": "name",
      "value_type": "String",
      "required": true,
      "multiple": false,
      "description": null
    }
  ],
  "source": "ManPage",
  "confidence": 0.75,
  "version": null
}