{
  "schema_version": "1.0.0",
  "command": "time",
  "description": "Run COMMAND, then print system resource usage.",
  "global_flags": [
    {
      "short": "-a",
      "long": "--append",
      "value_type": "Bool",
      "takes_value": false,
      "description": "with -o FILE, append instead of overwriting",
      "multiple": false,
      "conflicts_with": [],
      "requires": []
    },
    {
      "short": "-f",
      "long": "--format",
      "value_type": "String",
      "takes_value": true,
      "description": "use the specified FORMAT instead of the default",
      "multiple": false,
      "conflicts_with": [],
      "requires": []
    },
    {
      "short": "-h",
      "long": "--help",
      "value_type": "Bool",
      "takes_value": false,
      "description": null,
      "multiple": false,
      "conflicts_with": [],
      "requires": []
    },
    {
      "short": "-o",
      "long": "--output",
      "value_type": "File",
      "takes_value": true,
      "description": "write to FILE instead of STDERR",
      "multiple": false,
      "conflicts_with": [],
      "requires": []
    },
    {
      "short": "-p",
      "long": "--portability",
      "value_type": "Bool",
      "takes_value": false,
      "description": "print POSIX standard 1003.2 conformant string: real %%e user %%U sys %%S",
      "multiple": false,
      "conflicts_with": [],
      "requires": []
    },
    {
      "short": "-q",
      "long": "--quiet",
      "value_type": "Bool",
      "takes_value": false,
      "description": "do not print information about abnormal program termination (non-zero exit codes or signals)",
      "multiple": false,
      "conflicts_with": [],
      "requires": []
    },
    {
      "short": "-v",
      "long": "--verbose",
      "value_type": "Bool",
      "takes_value": false,
      "description": "print all resource usage information instead of the default format",
      "multiple": false,
      "conflicts_with": [],
      "requires": []
    },
    {
      "short": "-V",
      "long": "--version",
      "value_type": "Bool",
      "takes_value": false,
      "description": null,
      "multiple": false,
      "conflicts_with": [],
      "requires": []
    }
  ],
  "subcommands": [],
  "positional": [],
  "source": "HelpCommand",
  "confidence": 0.8,
  "version": null
}