{
  "command": "unxz",
  "description": "Compress or decompress FILEs in the .xz format.",
  "global_flags": [
    {
      "short": "-z",
      "long": "--compress",
      "value_type": "Bool",
      "takes_value": false,
      "description": "force compression",
      "multiple": false,
      "conflicts_with": [],
      "requires": []
    },
    {
      "short": "-d",
      "long": "--decompress",
      "value_type": "Bool",
      "takes_value": false,
      "description": "force decompression",
      "multiple": false,
      "conflicts_with": [],
      "requires": []
    },
    {
      "short": "-f",
      "long": "--force",
      "value_type": "Bool",
      "takes_value": false,
      "description": "force overwrite of output file and (de)compress links",
      "multiple": false,
      "conflicts_with": [],
      "requires": []
    },
    {
      "short": "-h",
      "long": "--help",
      "value_type": "Bool",
      "takes_value": false,
      "description": "display this short help and exit",
      "multiple": false,
      "conflicts_with": [],
      "requires": []
    },
    {
      "short": "-k",
      "long": "--keep",
      "value_type": "Bool",
      "takes_value": false,
      "description": "keep (don't delete) input files",
      "multiple": false,
      "conflicts_with": [],
      "requires": []
    },
    {
      "short": "-l",
      "long": "--list",
      "value_type": "Bool",
      "takes_value": false,
      "description": "list information about .xz files",
      "multiple": false,
      "conflicts_with": [],
      "requires": []
    },
    {
      "short": "-H",
      "long": "--long-help",
      "value_type": "Bool",
      "takes_value": false,
      "description": "display the long help (lists also the advanced options)",
      "multiple": false,
      "conflicts_with": [],
      "requires": []
    },
    {
      "short": "-c",
      "long": "--stdout",
      "value_type": "File",
      "takes_value": true,
      "description": "write to standard output and don't delete input files -0 ... -9           compression preset; default is 6; take compressor *and* decompressor memory usage into account before using 7-9! -e, --extreme       try to improve compression ratio by using more CPU time; does not affect decompressor memory requirements -T, --threads=NUM   use at most NUM threads; the default is 1; set to 0 to use as many threads as there are processor cores -q, --quiet         suppress warnings; specify twice to suppress errors too -v, --verbose       be verbose; specify twice for even more verbose",
      "multiple": false,
      "conflicts_with": [],
      "requires": []
    },
    {
      "short": "-t",
      "long": "--test",
      "value_type": "Bool",
      "takes_value": false,
      "description": "test compressed file integrity",
      "multiple": false,
      "conflicts_with": [],
      "requires": []
    },
    {
      "short": "-V",
      "long": "--version",
      "value_type": "Bool",
      "takes_value": false,
      "description": "display the version number and exit",
      "multiple": false,
      "conflicts_with": [],
      "requires": []
    }
  ],
  "subcommands": [],
  "positional": [],
  "source": "HelpCommand",
  "confidence": 0.8,
  "version": null
}