{
  "schema_version": "1.0.0",
  "command": "gpg-wks-client",
  "description": "gpg-wks-client (GnuPG) 2.4.4",
  "global_flags": [
    {
      "short": null,
      "long": "--add-revocs",
      "value_type": "Bool",
      "takes_value": false,
      "description": "add revocation certificates",
      "multiple": false,
      "conflicts_with": [],
      "requires": []
    },
    {
      "short": null,
      "long": "--check",
      "value_type": "Bool",
      "takes_value": false,
      "description": "check whether a key is available",
      "multiple": false,
      "conflicts_with": [],
      "requires": []
    },
    {
      "short": null,
      "long": "--create",
      "value_type": "Bool",
      "takes_value": false,
      "description": "create a publication request",
      "multiple": false,
      "conflicts_with": [],
      "requires": []
    },
    {
      "short": null,
      "long": "--install-key",
      "value_type": "Bool",
      "takes_value": false,
      "description": "install a key into a directory",
      "multiple": false,
      "conflicts_with": [],
      "requires": []
    },
    {
      "short": null,
      "long": "--mirror",
      "value_type": "Bool",
      "takes_value": false,
      "description": "mirror an LDAP directory",
      "multiple": false,
      "conflicts_with": [],
      "requires": []
    },
    {
      "short": null,
      "long": "--no-add-revocs",
      "value_type": "Bool",
      "takes_value": false,
      "description": "do not add revocation certificates",
      "multiple": false,
      "conflicts_with": [],
      "requires": []
    },
    {
      "short": "-o",
      "long": "--output",
      "value_type": "File",
      "takes_value": true,
      "description": "write the mail to FILE",
      "multiple": false,
      "conflicts_with": [],
      "requires": []
    },
    {
      "short": null,
      "long": "--print-wkd-hash",
      "value_type": "Bool",
      "takes_value": false,
      "description": "print the WKD identifier for the given user ids",
      "multiple": false,
      "conflicts_with": [],
      "requires": []
    },
    {
      "short": null,
      "long": "--print-wkd-url",
      "value_type": "Bool",
      "takes_value": false,
      "description": "print the WKD URL for the given user id",
      "multiple": false,
      "conflicts_with": [],
      "requires": []
    },
    {
      "short": "-q",
      "long": "--quiet",
      "value_type": "Bool",
      "takes_value": false,
      "description": "be somewhat more quiet",
      "multiple": false,
      "conflicts_with": [],
      "requires": []
    },
    {
      "short": null,
      "long": "--read",
      "value_type": "Bool",
      "takes_value": false,
      "description": "receive a plain text confirmation request",
      "multiple": false,
      "conflicts_with": [],
      "requires": []
    },
    {
      "short": null,
      "long": "--receive",
      "value_type": "Bool",
      "takes_value": false,
      "description": "receive a MIME confirmation request",
      "multiple": false,
      "conflicts_with": [],
      "requires": []
    },
    {
      "short": null,
      "long": "--remove-key",
      "value_type": "Bool",
      "takes_value": false,
      "description": "remove a key from a directory",
      "multiple": false,
      "conflicts_with": [],
      "requires": []
    },
    {
      "short": null,
      "long": "--send",
      "value_type": "Bool",
      "takes_value": false,
      "description": "send the mail using sendmail",
      "multiple": false,
      "conflicts_with": [],
      "requires": []
    },
    {
      "short": null,
      "long": "--status-fd",
      "value_type": "String",
      "takes_value": true,
      "description": "write status info to this FD",
      "multiple": false,
      "conflicts_with": [],
      "requires": []
    },
    {
      "short": null,
      "long": "--supported",
      "value_type": "Bool",
      "takes_value": false,
      "description": "check whether provider supports WKS",
      "multiple": false,
      "conflicts_with": [],
      "requires": []
    },
    {
      "short": "-v",
      "long": "--verbose",
      "value_type": "Bool",
      "takes_value": false,
      "description": "verbose",
      "multiple": false,
      "conflicts_with": [],
      "requires": []
    }
  ],
  "subcommands": [],
  "positional": [],
  "source": "HelpCommand",
  "confidence": 0.8,
  "version": "2.4.4"
}