{
  "schema_version": "1.0.0",
  "command": "mii-tool",
  "description": null,
  "global_flags": [
    {
      "short": "-A",
      "long": "--advertise",
      "value_type": "String",
      "takes_value": true,
      "description": "advertise only specified media",
      "multiple": true,
      "conflicts_with": [],
      "requires": []
    },
    {
      "short": "-F",
      "long": "--force",
      "value_type": "String",
      "takes_value": true,
      "description": "force specified media technology",
      "multiple": false,
      "conflicts_with": [],
      "requires": []
    },
    {
      "short": "-l",
      "long": "--log",
      "value_type": "Bool",
      "takes_value": false,
      "description": "with -w, write events to syslog",
      "multiple": false,
      "conflicts_with": [],
      "requires": []
    },
    {
      "short": "-p",
      "long": "--phy",
      "value_type": "String",
      "takes_value": true,
      "description": "set PHY (MII address) to report",
      "multiple": false,
      "conflicts_with": [],
      "requires": []
    },
    {
      "short": "-R",
      "long": "--reset",
      "value_type": "Bool",
      "takes_value": false,
      "description": "reset MII to poweron state",
      "multiple": false,
      "conflicts_with": [],
      "requires": []
    },
    {
      "short": "-r",
      "long": "--restart",
      "value_type": "Bool",
      "takes_value": false,
      "description": "restart autonegotiation",
      "multiple": false,
      "conflicts_with": [],
      "requires": []
    },
    {
      "short": "-v",
      "long": "--verbose",
      "value_type": "Bool",
      "takes_value": false,
      "description": "more verbose output",
      "multiple": false,
      "conflicts_with": [],
      "requires": []
    },
    {
      "short": "-V",
      "long": "--version",
      "value_type": "Bool",
      "takes_value": false,
      "description": "display version information",
      "multiple": false,
      "conflicts_with": [],
      "requires": []
    },
    {
      "short": "-w",
      "long": "--watch",
      "value_type": "Bool",
      "takes_value": false,
      "description": "monitor for link status changes",
      "multiple": false,
      "conflicts_with": [],
      "requires": []
    }
  ],
  "subcommands": [],
  "positional": [
    {
      "name": "MII",
      "value_type": "String",
      "required": true,
      "multiple": false,
      "description": null
    },
    {
      "name": "PHY",
      "value_type": "String",
      "required": true,
      "multiple": false,
      "description": null
    },
    {
      "name": "interface",
      "value_type": "String",
      "required": true,
      "multiple": false,
      "description": null
    },
    {
      "name": "media",
      "value_type": "String",
      "required": true,
      "multiple": true,
      "description": null
    }
  ],
  "source": "HelpCommand",
  "confidence": 0.85,
  "version": null
}